{"counts":{"assertions":11866,"comparable_field_conflicts":0,"conflicting_county_rows":11,"county_identity_quarantine_rows":48,"independently_corroborated_service_claims":0,"quarantine":51,"rejected_county_rows":0,"resolved_county_rows":11818,"service_territory_by_validation_status":{"accepted":11818,"conflicting":11,"unresolved":37},"service_territory_rows":11866,"sources":2,"unknown_utility_rows":3,"unresolved_county_rows":37,"utilities":3413,"utilities_by_validation_status":{"accepted":3380,"needs_review":33},"utility_activities":1706},"data_year":2024,"dataset":"3e63e1037b9c76681bcc73b4a41acb080f20172b664457f07419aa14fbee0bf7","generated_at":"2026-09-26T18:00:22.262176+00:00","limitations":["Coverage measures rows in the reviewed EIA-861 2024 final archive, not every operating utility or exclusive territory.","Census validates geographic identity and parentage only; it does not corroborate EIA service membership.","Unresolved, conflicting and rejected rows are preserved in quarantine and excluded from utility county filters."],"schema_version":"verified-directory-v1","source_vintages":{"census-geography-reference":"2025 boundaries / 2026 Gazetteer identities","eia-861-2024-final":"2024 final"}}
